<?xml version="1.0" encoding="UTF-8"?>
	<!--
		* Licensed to the Apache Software Foundation (ASF) under one * or more
		contributor license agreements. See the NOTICE file * distributed with
		this work for additional information * regarding copyright ownership.
		The ASF licenses this file * to you under the Apache License, Version
		2.0 (the * "License"); you may not use this file except in compliance
		* with the License. You may obtain a copy of the License at * *
		http://www.apache.org/licenses/LICENSE-2.0 * * Unless required by
		applicable law or agreed to in writing, * software distributed under
		the License is distributed on an * "AS IS" BASIS, WITHOUT WARRANTIES
		OR CONDITIONS OF ANY * KIND, either express or implied. See the
		License for the * specific language governing permissions and
		limitations * under the License.
	-->
<rules xmlns:xsi="http://www.w3.org/2001/XMLSchema-instance"
	xmlns="http://www.lina.univ-nantes.fr/uima/annotationmapper"
	xsi:schemaLocation="annotationMapperRules.xsd">
	
 	
	<rule id="XMLElementAnnotation2OCommonSentence" 
		description="">
		<pattern>
			<patternElement type="FrenchTreebankXML2CAS-to-UnivNantesLINATS.xml">
				<constraint>.[@qualifiedName='SENT']</constraint>
				<create type="common.types.text.Sentence" >
				
				</create>
			</patternElement>
		</pattern>
	</rule>
	

	-->
	<!-- 
	on the taln13 revised extended version
	//w[@sw="true" or @po="true"]
		 -->
	<rule id="XMLAttributeAnnotation2OpenNLPToken" 
		description="">
		<pattern>
			<patternElement type="fr.univnantes.lina.uima.connectors.types.XMLElementAnnotation">
				<constraint>.</constraint>
				<create type="common.types.text.Token" >
					
				</create>
			</patternElement>
		</pattern>
	</rule>
	

</rules>


