<?xml version="1.0" encoding="UTF-8"?>
	<!--
		* Licensed to the Apache Software Foundation (ASF) under one * or more
		contributor license agreements. See the NOTICE file * distributed with
		this work for additional information * regarding copyright ownership.
		The ASF licenses this file * to you under the Apache License, Version
		2.0 (the * "License"); you may not use this file except in compliance
		* with the License. You may obtain a copy of the License at * *
		http://www.apache.org/licenses/LICENSE-2.0 * * Unless required by
		applicable law or agreed to in writing, * software distributed under
		the License is distributed on an * "AS IS" BASIS, WITHOUT WARRANTIES
		OR CONDITIONS OF ANY * KIND, either express or implied. See the
		License for the * specific language governing permissions and
		limitations * under the License.
	-->
<rules xmlns:xsi="http://www.w3.org/2001/XMLSchema-instance"
	xmlns="http://www.lina.univ-nantes.fr/uima/annotationmapper"
	xsi:schemaLocation="annotationMapperRules.xsd">

	<rule id="NESternCorpusNewsItem2CommonTypes" 
		description="">
		<pattern>
			<patternElement type="fr.univnantes.lina.uima.connectors.types.XMLElementAnnotation">
				<constraint>.[@qualifiedName="news_item"]</constraint>
				<create type="common.types.text.Article" >
				</create>
			</patternElement>
		</pattern>
	</rule>
		
	<rule id="NESternCorpusNewsHeader2CommonTypes" 
		description="">
		<pattern>
			<patternElement type="fr.univnantes.lina.uima.connectors.types.XMLElementAnnotation">
				<constraint>.[@qualifiedName="news_head"]</constraint>
				<create type="common.types.text.Header" >
				</create>
			</patternElement>
		</pattern>
	</rule>
	
	<rule id="NESternCorpusNewsTextCommonTypes" 
		description="">
		<pattern>
			<patternElement type="fr.univnantes.lina.uima.connectors.types.XMLElementAnnotation">
				<constraint>.[@qualifiedName="news_text"]</constraint>
				<create type="common.types.text.Text" >
				</create>
			</patternElement>
		</pattern>
	</rule>

	<rule id="NESternCorpusPara2CommonTypes" 
		description="">
		<pattern>
			<patternElement type="fr.univnantes.lina.uima.connectors.types.XMLElementAnnotation">
				<constraint>.[@qualifiedName="para"]</constraint>
				<create type="common.types.text.Paragraph" >
				</create>
			</patternElement>
		</pattern>
	</rule>
	
	  <rule id="NESternCorpusENAMEX2CommonTypes" 
		description="">
		<pattern>
			<patternElement type="fr.univnantes.lina.uima.connectors.types.XMLElementAnnotation">
				<constraint>.[@qualifiedName="ENAMEX"]</constraint>
				<create type="common.types.classification.PositiveGoldSample" >
				</create>
			</patternElement>
		</pattern>
	</rule>
	<!--
		<rule id="NESternCorpusENAMEXLocation2CommonTypes" 
		description="">
		<pattern>
			<patternElement type="fr.univnantes.lina.uima.connectors.types.XMLAttributeAnnotation">
				<constraint>.[@localName="type" and @value="Location"]</constraint>
				<create type="common.types.classification.PositiveGoldSample" >
				</create>
			</patternElement>
		</pattern>
	</rule>-->
	
	<!-- More rule examples in Poulard Reported Speech to common types -->
	
</rules>


