<?xml version="1.0" encoding="UTF-8"?>
	<!--
		* Licensed to the Apache Software Foundation (ASF) under one * or more
		contributor license agreements. See the NOTICE file * distributed with
		this work for additional information * regarding copyright ownership.
		The ASF licenses this file * to you under the Apache License, Version
		2.0 (the * "License"); you may not use this file except in compliance
		* with the License. You may obtain a copy of the License at * *
		http://www.apache.org/licenses/LICENSE-2.0 * * Unless required by
		applicable law or agreed to in writing, * software distributed under
		the License is distributed on an * "AS IS" BASIS, WITHOUT WARRANTIES
		OR CONDITIONS OF ANY * KIND, either express or implied. See the
		License for the * specific language governing permissions and
		limitations * under the License.
	-->
<rules xmlns:xsi="http://www.w3.org/2001/XMLSchema-instance"
	xmlns="http://www.lina.univ-nantes.fr/uima/annotationmapper"
	xsi:schemaLocation="annotationMapperRules.xsd">


	<rule id="TutinArcadeCorpusText2CommonTypes" 
		description="">
		<pattern>
			<patternElement type="common.types.extml.XMLElementAnnotation">
				<constraint>.[@qualifiedName="text"]</constraint>
				<create type="common.types.text.Text" >
				</create>
			</patternElement>
		</pattern>
	</rule>
	
	 <rule id="TutinArcadeCorpusHead2CommonTypes" 
    description="">
    <pattern>
      <patternElement type="common.types.extml.XMLElementAnnotation">
        <constraint>.[@qualifiedName="head"]</constraint>
        <create type="common.types.text.Title" >
        </create>
      </patternElement>
    </pattern>
  </rule>
	
	  <rule id="TutinArcadeCorpusParagraph2CommonTypes" 
    description="">
    <pattern>
      <patternElement type="common.types.extml.XMLElementAnnotation">
        <constraint>.[@qualifiedName="p"]</constraint>
        <create type="common.types.text.Paragraph" >
        </create>
      </patternElement>
    </pattern>
  </rule>
  
  <!-- !! ne pas faire double emploi avec l'utilisation de la chaîne de traitement opennlp qui détecte aussi les phrases  -->
  <rule id="TutinArcadeCorpusSentence2CommonTypes" 
    description="">
    <pattern>
      <patternElement type="common.types.extml.XMLElementAnnotation">
        <constraint>.[@qualifiedName="s"]</constraint>
        <create type="common.types.text.Sentence" >
        </create>
      </patternElement>
    </pattern>
  </rule>
  
     <rule id="TutinArcadeCorpusCoreference2CommonTypes" 
    description="">
    <pattern>
      <patternElement type="common.types.extml.XMLElementAnnotation">
        <constraint>.[@qualifiedName="exp"]</constraint>
        <create type="common.types.coref.Coreference" >
          <setFeature name="id" value="./*[qualifiedName='id']/@value"/>
          <setFeature name="corefType" value="./*[qualifiedName='type']/@value"/>
          <setFeature name="src" value="./*[qualifiedName='src']/@value"/>
        
        </create>
      </patternElement>
    </pattern>
  </rule>
	
	<!-- More rule examples in Poulard Reported Speech to common types -->
	

</rules>


