<?xml version="1.0" encoding="UTF-8"?>
<!-- Licensed to the Apache Software Foundation (ASF) under one * or more 
	contributor license agreements. See the NOTICE file * distributed with this 
	work for additional information * regarding copyright ownership. The ASF 
	licenses this file * to you under the Apache License, Version 2.0 (the * 
	"License"); you may not use this file except in compliance * with the License. 
	You may obtain a copy of the License at * * http://www.apache.org/licenses/LICENSE-2.0 
	* * Unless required by applicable law or agreed to in writing, * software 
	distributed under the License is distributed on an * "AS IS" BASIS, WITHOUT 
	WARRANTIES OR CONDITIONS OF ANY * KIND, either express or implied. See the 
	License for the * specific language governing permissions and limitations 
	* under the License. -->
<rules xmlns:xsi="http://www.w3.org/2001/XMLSchema-instance"
	xmlns="http://www.lina.univ-nantes.fr/uima/annotationmapper"
	xsi:schemaLocation="annotationMapperRules.xsd">

	<!-- Exemples extrait de Stern et Sagot -->
	<!-- <ENAMEX eid="2000000003014856" type="Location" sub_type="City" gnfeature="PPL" 
		gnccode="FR" name="Grasse">Grasse</ENAMEX> -->
	<!-- <EX_ENAMEX type="Organization" name="collège de Cannes">collège de 
		Cannes</EX_ENAMEX> -->
	<!-- <ENAMEX eid="1000000001207572" type="Person" name="Agustín Carstens">Agustin 
		Carstens</ENAMEX> -->

	<rule id="ENAMEXAny2CommonTypes" description="">
		<pattern>
			<patternElement
				type="fr.univnantes.lina.uima.connectors.types.XMLElementAnnotation">
				<constraint>.[@qualifiedName="ENAMEX" and ./*[@qualifiedName='name']/@value]</constraint>
				<create type="common.types.ne.NamedEntity">
					<setFeature name="category" value="./*[@qualifiedName='type']/@value" />
					<setFeature name="value" value="./*[@qualifiedName='name']/@value" />
				</create>
			</patternElement>
		</pattern>
	</rule>

	<rule id="ENAMEXPerson2CommonTypes" description="">
		<pattern>
			<patternElement
				type="fr.univnantes.lina.uima.connectors.types.XMLElementAnnotation">
				<constraint>.[@qualifiedName="ENAMEX" and ./*[@value="Person"] and ./*[@qualifiedName='name']/@value]
				</constraint>
				<create type="common.types.ne.Person">
					<setFeature name="value" value="./*[@qualifiedName='name']/@value" />
				</create>
			</patternElement>
		</pattern>
	</rule>

	<rule id="ENAMEXLocation2CommonTypes" description="">
		<pattern>
			<patternElement
				type="fr.univnantes.lina.uima.connectors.types.XMLElementAnnotation">
				<constraint>.[@qualifiedName="ENAMEX" and ./*[@value="Location"] and ./*[@qualifiedName='name']/@value]
				</constraint>
				<create type="common.types.ne.Location">
					<setFeature name="value" value="./*[@qualifiedName='name']/@value" />
				</create>
			</patternElement>
		</pattern>
	</rule>

	<rule id="ENAMEXOrganization2CommonTypes" description="">
		<pattern>
			<patternElement
				type="fr.univnantes.lina.uima.connectors.types.XMLElementAnnotation">
				<constraint>.[@qualifiedName="ENAMEX" and
					./*[@value="Organization"] and ./*[@qualifiedName='name']/@value]
				</constraint>
				<create type="common.types.ne.Organization">
					<setFeature name="value" value="./*[@qualifiedName='name']/@value" />
				</create>
			</patternElement>
		</pattern>
	</rule>

	<!-- Alternative create Person/Location/Organization from XMLattribute (faster 
		but from the XMLelement accept more constraints) -->
	<!-- <rule id="NESternCorpusENAMEXPerson2CommonTypes" description=""> <pattern> 
		<patternElement type="fr.univnantes.lina.uima.connectors.types.XMLAttributeAnnotation"> 
		<constraint>.[@qualifiedName="type" and @value="Person" and ./element[@qualifiedName="ENAMEX"]] 
		</constraint> <create type="common.types.ne.Person"> </create> </patternElement> 
		</pattern> </rule> <rule id="NESternCorpusENAMEXLocation2CommonTypes" description=""> 
		<pattern> <patternElement type="fr.univnantes.lina.uima.connectors.types.XMLAttributeAnnotation"> 
		<constraint>.[@qualifiedName="type" and @value="Location" and ./element[@qualifiedName="ENAMEX"]] 
		</constraint> <create type="common.types.ne.Location"> </create> </patternElement> 
		</pattern> </rule> <rule id="NESternCorpusENAMEXOrganization2CommonTypes" 
		description=""> <pattern> <patternElement type="fr.univnantes.lina.uima.connectors.types.XMLAttributeAnnotation"> 
		<constraint>.[@qualifiedName="type" and @value="Organization" and ./element[@qualifiedName="ENAMEX"]] 
		</constraint> <create type="common.types.ne.Organization"> </create> </patternElement> 
		</pattern> </rule> -->

	<!-- Exemples extraits de A. Bittar FR-TimeBank -->
	<!-- <TIMEX3 anchorTimeID="t1" temporalFunction="true" tid="t6" type="DATE" 
		value="1999-05-23TEV" valueFromFunction="tf3">Dimanche soir</TIMEX3> -->
	<!-- <TIMEX3 endPoint="t1" temporalFunction="true" tid="t3" type="DURATION" 
		value="PXD" valueFromFunction="tf19">Ces derniers jours</TIMEX3> -->
	<!-- <TIMEX3 tid="t4" type="TIME" value="T14:00">14 h</TIMEX3> -->


	<rule id="TIMEX3Any2CommonTypes" description="">
		<pattern>
			<patternElement
				type="fr.univnantes.lina.uima.connectors.types.XMLElementAnnotation">
				<constraint>.[@qualifiedName="TIMEX3" and
					not(./*[@qualifiedName="functionInDocument"])]
				</constraint>
				<create type="common.types.ne.NamedEntity">
					<setFeature name="category" value="./*[@qualifiedName='type']/@value" />
					<setFeature name="value" value="./*[@qualifiedName='value']/@value" />

				</create>
			</patternElement>
		</pattern>
	</rule>


	<rule id="TIMEX3Date2CommonTypes" description="">
		<pattern>
			<patternElement
				type="fr.univnantes.lina.uima.connectors.types.XMLElementAnnotation">
				<constraint>.[@qualifiedName="TIMEX3"
					and
					not(./*[@qualifiedName="functionInDocument"])
					and
					./*[@value="DATE"]]
				</constraint>
				<create type="common.types.ne.Date">
					<setFeature name="value" value="./*[@qualifiedName='value']/@value" />
				</create>
			</patternElement>
		</pattern>
	</rule>


	<rule id="TIMEX3Time2CommonTypes" description="">
		<pattern>
			<patternElement
				type="fr.univnantes.lina.uima.connectors.types.XMLElementAnnotation">
				<constraint>.[@qualifiedName="TIMEX3"
					and
					not(./*[@qualifiedName="functionInDocument"])
					and
					./*[@value="TIME"]]
				</constraint>
				<create type="common.types.ne.Time">
					<setFeature name="value" value="./*[@qualifiedName='value']/@value" />
				</create>
			</patternElement>
		</pattern>
	</rule>

	<!-- We should differ from date and time duration ; not the case actually -->
	<rule id="TIMEX3Duration2CommonTypes" description="">
		<pattern>
			<patternElement
				type="fr.univnantes.lina.uima.connectors.types.XMLElementAnnotation">
				<constraint>.[@qualifiedName="TIMEX3"
					and not(./*[@qualifiedName="functionInDocument"])
					and
					./*[@value="DURATION"]]
				</constraint>
				<create type="common.types.ne.Duration">
					<setFeature name="value" value="./*[@qualifiedName='value']/@value" />
				</create>
			</patternElement>
		</pattern>
	</rule>
	
	
  <!-- We should differ from date and time duration ; not the case actually -->
  <rule id="TIMEX3Set2CommonTypes" description="">
    <pattern>
      <patternElement
        type="fr.univnantes.lina.uima.connectors.types.XMLElementAnnotation">
        <constraint>.[@qualifiedName="TIMEX3"
          and not(./*[@qualifiedName="functionInDocument"])
          and
          ./*[@value="SET"]]
        </constraint>
        <create type="common.types.ne.TimexSet">
          <setFeature name="value" value="./*[@qualifiedName='value']/@value" />
        </create>
      </patternElement>
    </pattern>
  </rule>

	<!-- More rule examples in Poulard Reported Speech to common types -->
</rules>


