<?xml version="1.0" encoding="UTF-8"?>
	<!--
		* Licensed to the Apache Software Foundation (ASF) under one * or more
		contributor license agreements. See the NOTICE file * distributed with
		this work for additional information * regarding copyright ownership.
		The ASF licenses this file * to you under the Apache License, Version
		2.0 (the * "License"); you may not use this file except in compliance
		* with the License. You may obtain a copy of the License at * *
		http://www.apache.org/licenses/LICENSE-2.0 * * Unless required by
		applicable law or agreed to in writing, * software distributed under
		the License is distributed on an * "AS IS" BASIS, WITHOUT WARRANTIES
		OR CONDITIONS OF ANY * KIND, either express or implied. See the
		License for the * specific language governing permissions and
		limitations * under the License.
	-->
<rules xmlns:xsi="http://www.w3.org/2001/XMLSchema-instance"
	xmlns="http://www.lina.univ-nantes.fr/uima/annotationmapper"
	xsi:schemaLocation="annotationMapperRules.xsd">
	
	<!-- Fonctions XPath http://www.gchagnon.fr/cours/xml/fonctionsxpath.html#caracteres -->
	
  	<rule id="Sentence" 
		description="">
		<pattern>
			<patternElement type="fr.univnantes.lina.uima.connectors.types.XMLElementAnnotation">
				<constraint>.[@elementName='SENT']</constraint>
				<create type="org.apache.uima.SentenceAnnotation" >
				</create>
			</patternElement>
		</pattern>
	</rule>
	
	
	
	<!--
		<rule id="XMLAttributeAnnotationW2TokenAnnotationPosTag" 
		description="SÃ©lection de certaines valeurs d'attribut cat (pos), subcat (grammatical function e.g. suj...), mph (morphology e.g. 3ms, fp), ee (cat-subcat-mph), lemma (lemma)">
		<pattern>
			<patternElement type="fr.univnantes.lina.uima.connectors.types.XMLAttributeAnnotation">
				<constraint>.[@elementName='w' and @attributeName='cat' and @attributeValue!=""]</constraint>
				<create type="org.apache.uima.TokenAnnotation" >
					<setFeature name="posTag" value="./@attributeValue"/>
				</create>
			</patternElement>
		</pattern>
	</rule> 
	 -->
	 <!--  and not(contains(@coveredText,' ')) -->
	
	
		<rule id="TokenAnnotation:pos" 
		description="training for posTagger">
		<pattern>
			<patternElement type="fr.univnantes.lina.uima.connectors.types.XMLAttributeAnnotation">
				<constraint>.[@elementName='w' and @attributeName='cat']</constraint>
				<create type="org.apache.uima.TokenAnnotation" >
						<setFeature name="posTag" value="./@attributeValue"/>
				</create>
			</patternElement>
		</pattern>
	</rule>

</rules>


